{
  "schema": "cap.test-strategy/v1",
  "boundary_modes": ["REAL", "FIXTURE_ALLOWED", "STUB_ALLOWED", "MOCK_ONLY"],
  "tiers": [
    {"name": "unit", "purpose": "one module or package in isolation; no network, no containers", "ci_job": "unit", "budget_s": 600, "boundary_modes": ["FIXTURE_ALLOWED", "STUB_ALLOWED", "MOCK_ONLY"]},
    {"name": "component", "purpose": "one deployable through its own interfaces, external boundaries replaced", "ci_job": "unit", "budget_s": 600, "boundary_modes": ["FIXTURE_ALLOWED", "STUB_ALLOWED"]},
    {"name": "contract", "purpose": "published schemas, examples and API contracts against their consumers' expectations", "ci_job": "contract", "budget_s": 300, "boundary_modes": ["REAL", "FIXTURE_ALLOWED"]},
    {"name": "integration", "purpose": "real infrastructure (PostgreSQL, NATS JetStream, Collector, OpenObserve, Compose profiles) and real processes", "ci_job": "integration", "budget_s": 1200, "boundary_modes": ["REAL", "FIXTURE_ALLOWED"]},
    {"name": "scenario", "purpose": "integrated acceptance paths (E2E-*, AV-SCEN-*) across deployables", "ci_job": null, "budget_s": 3600, "boundary_modes": ["REAL"]},
    {"name": "benchmark", "purpose": "measurements against NFR thresholds on a documented HardwareProfile; run on request, never a pass/fail gate by retry", "ci_job": null, "budget_s": 3600, "boundary_modes": ["REAL"]}
  ],
  "test_id": {
    "pattern": "^TEST-[A-Z]+-[0-9]{3}-[0-9]{3}$",
    "rule": "TEST-<AREA>-<NNN>-<SSS>: AREA-NNN is the producing work package WP-<AREA>-<NNN>, SSS a sequence within it; each concrete asset names its 03 planned family",
    "legacy": ["TEST-CICD-001", "TEST-CICD-002", "TEST-CICD-003"]
  },
  "suites": [
    {"path": "ci/tests", "owner": "Yavuz", "work_package": "WP-CICD-001", "families": ["TEST-DX-FLAKE"], "test_ids": ["TEST-CICD-001", "TEST-CICD-002", "TEST-TEST-001-001"],
     "runs": [{"tier": "unit", "boundary_mode": "FIXTURE_ALLOWED", "ci_step": "CI tooling tests"}]},
    {"path": "ci/integration", "owner": "Yavuz", "work_package": "WP-CICD-001", "families": [], "family_note": "integration-tier gate integrity (03 §19.2: no planned family)", "test_ids": ["TEST-CICD-003"],
     "runs": [{"tier": "integration", "boundary_mode": "REAL", "ci_step": "Integration smoke (boundary mode REAL)"}]},
    {"path": "packages/observability/tests", "owner": "Yavuz", "work_package": "WP-OBS-001", "families": ["TEST-OBS-LOGS", "TEST-OBS-HEALTH"], "test_ids": ["TEST-OBS-001-001", "TEST-OBS-001-003", "TEST-OBS-001-004"],
     "runs": [{"tier": "unit", "boundary_mode": "FIXTURE_ALLOWED", "ci_step": "Observability standard tests and typing (WP-OBS-001)"}]},
    {"path": "packages/artifacts/tests", "owner": "Yavuz", "work_package": "WP-OBJ-001", "families": ["TEST-DATA-CHECKSUM"], "test_ids": ["TEST-OBJ-001-001", "TEST-OBJ-001-002", "TEST-OBJ-001-003", "TEST-OBJ-001-004", "TEST-OBJ-001-005", "TEST-OBJ-001-006", "TEST-OBJ-001-007"],
     "runs": [{"tier": "unit", "boundary_mode": "STUB_ALLOWED", "ci_step": "Artifact reference contract tests and typing (WP-OBJ-001)"},
              {"tier": "integration", "boundary_mode": "REAL", "ci_step": "Artifact store tests (REAL SeaweedFS, WP-OBJ-001)"}]},
    {"path": "infra/observability/tests", "owner": "Yavuz", "work_package": "WP-OBS-001", "families": ["TEST-OBS-TELEMETRY"], "test_ids": ["TEST-OBS-001-002"],
     "runs": [{"tier": "unit", "boundary_mode": "FIXTURE_ALLOWED", "ci_step": "Observability standard tests and typing (WP-OBS-001)"},
              {"tier": "integration", "boundary_mode": "REAL", "ci_step": "Telemetry pipeline smoke (boundary mode REAL)"}]},
    {"path": "infra/compose/tests", "owner": "Yavuz", "work_package": "WP-PLAT-001", "families": ["TEST-PLAT-COMPOSE"], "test_ids": ["TEST-PLAT-001-001", "TEST-PLAT-001-002"],
     "runs": [{"tier": "unit", "boundary_mode": "FIXTURE_ALLOWED", "ci_step": "Platform composition definition tests (WP-PLAT-001)"},
              {"tier": "integration", "boundary_mode": "REAL", "ci_step": "Platform runtime tests (boundary mode REAL)"}]},
    {"path": "tools/mfgctl/tests", "owner": "Yavuz", "work_package": "WP-PLAT-002", "families": ["TEST-PLAT-FABCTL"], "test_ids": ["TEST-PLAT-002-001", "TEST-PLAT-002-002", "TEST-PLAT-002-003", "TEST-PLAT-002-004"],
     "runs": [{"tier": "unit", "boundary_mode": "FIXTURE_ALLOWED", "ci_step": "mfgctl tests (quarantine-aware)"}]},
    {"path": "tools/trace/tests", "owner": "Yavuz", "work_package": "WP-GOV-002", "families": ["TEST-GOV-TRACELINT"], "test_ids": ["TEST-GOV-002-001", "TEST-GOV-002-002", "TEST-GOV-002-003", "TEST-GOV-002-004"],
     "runs": [{"tier": "unit", "boundary_mode": "FIXTURE_ALLOWED", "ci_step": "Trace registry lint and tests (WP-GOV-002)"}]},
    {"path": "tools/projectctl/tests", "owner": "Asrın", "work_package": "WP-GOV-001", "families": [], "family_note": "family allocation by the owning work package", "test_ids": [],
     "runs": [{"tier": "unit", "boundary_mode": "FIXTURE_ALLOWED", "ci_step": "projectctl tests (quarantine-aware)"}]},
    {"path": "tools/host/plane-queue", "owner": "Asrın", "work_package": null, "families": [], "family_note": "host control items (CTRL-HOST), no product requirement", "test_ids": [],
     "runs": [{"tier": "unit", "boundary_mode": "FIXTURE_ALLOWED", "ci_step": "Host Plane queue tests (offline)"}]},
    {"path": "tools/host/plane-transition", "owner": "Asrın", "work_package": null, "families": [], "family_note": "host control items (CTRL-HOST), no product requirement", "test_ids": [],
     "runs": [{"tier": "unit", "boundary_mode": "FIXTURE_ALLOWED", "ci_step": "Host Plane transition tests (offline)"}]},
    {"path": "packages/event-consumer/tests", "owner": "Asrın", "work_package": "WP-EVT-003", "families": [], "family_note": "family allocation by the owning work package", "test_ids": [],
     "runs": [{"tier": "unit", "boundary_mode": "FIXTURE_ALLOWED", "ci_step": "Consumer framework pure checks (WP-EVT-003)"},
              {"tier": "integration", "boundary_mode": "REAL", "ci_step": "Consumer idempotency acceptance (REAL PostgreSQL and JetStream, WP-EVT-003)"}]},
    {"path": "services/manufacturing-core/tests", "owner": "Asrın", "work_package": "WP-CORE-001", "families": [], "family_note": "family allocation by the owning work package", "test_ids": [],
     "runs": [{"tier": "unit", "boundary_mode": "FIXTURE_ALLOWED", "ci_step": "Core pure domain tests and typing (WP-CORE-001)"}]},
    {"path": "services/manufacturing-core/tests/persistence", "owner": "Asrın", "work_package": "WP-CORE-001", "families": [], "family_note": "family allocation by the owning work package", "test_ids": [],
     "runs": [{"tier": "integration", "boundary_mode": "REAL", "ci_step": "Core initial migration and persistence (real PostgreSQL 18)"}]},
    {"path": "services/manufacturing-simulator/tests", "owner": "Batu", "work_package": "WP-SIM-001", "families": [], "family_note": "family allocation by the owning work package", "test_ids": [],
     "runs": [{"tier": "unit", "boundary_mode": "FIXTURE_ALLOWED", "ci_step": "Simulator kernel unit/property tests and typing (WP-SIM-001)"}]},
    {"path": "services/operations-bff/tests", "owner": "Asrın", "work_package": "WP-UI-001", "families": [], "family_note": "family allocation by the owning work package", "test_ids": [],
     "runs": [{"tier": "contract", "boundary_mode": "FIXTURE_ALLOWED", "ci_step": "Operations BFF v1 contract tests and typing (WP-UI-001)"}]},
    {"path": "services/command-center-web/src", "owner": "Asrın", "work_package": "WP-UI-001", "families": [], "family_note": "family allocation by the owning work package", "test_ids": [],
     "runs": [{"tier": "unit", "boundary_mode": "STUB_ALLOWED", "ci_step": "Frontend component tests (WP-UI-001)"}]},
    {"path": "services/command-center-web/e2e", "owner": "Asrın", "work_package": "WP-UI-001", "families": ["TEST-UI-BROWSER"], "test_ids": [],
     "runs": [{"tier": "integration", "boundary_mode": "FIXTURE_ALLOWED", "fixture_boundaries": ["scripted identity provider", "fixture Core and Twin readers"], "ci_step": "Browser acceptance against a real BFF process (TEST-UI-BROWSER, WP-UI-001)"}]},
    {"path": "services/command-center-web/e2e/bench.spec.ts", "owner": "Asrın", "work_package": "WP-UI-001", "families": [], "family_note": "engineering measurement through the test harness; not acceptance evidence", "test_ids": [],
     "runs": [{"tier": "component", "boundary_mode": "FIXTURE_ALLOWED", "ci_step": null, "on_request": "npm run bench:ui (BENCH=1); never a CI gate"}]}
  ]
}
